Question,Default Weight,Category,Opportunity Type,Opportunity Subtypes
In house pricing tool,10,Additional Capabilities for Agent Interactions,CCaaS,IVA
Workday,10,Additional Capabilities for Agent Interactions,CCaaS,IVA
Monday.com,Pass/Fail,Integrations,CCaaS,IVA
ISI POS (does not appear to have any API capability),10,Integrations,CCaaS,IVA
In house POS (Custom) - need open APIs,10,Integrations,CCaaS,IVA
LLMs,10,Integrations,CCaaS,IVA
Retail specific use cases,10,Integrations,CCaaS,IVA
Network Monitoring (Solarwinds),10,Integrations,CCaaS,IVA
Network Monitoring (FortiMonitor),10,Integrations,CCaaS,IVA
Year UCaaS platform introduced,10,Integrations,CCaaS,IVA
Current UCaaS seats deployed,10,Integrations,CCaaS,IVA
Number of carrier NNIs into the PSTN,10,Integrations,CCaaS,IVA
SOX,10,Integrations,CCaaS,IVA
GDPR,10,Integrations,CCaaS,IVA
CCPA (California Consumer Privacy Act),10,Overview,UCaaS,Phone System
Support multiple sites,10,Overview,UCaaS,Phone System
Automated failover between multiple datacenters for call control,Info,Overview,UCaaS,Phone System
Are datacenters active/active?,10,Overview,UCaaS,Phone System
VM to Email,10,Overview,UCaaS,Phone System
VM to text/SMS,10,Overview,UCaaS,Phone System
VM transcription,10,Overview,UCaaS,Phone System
Shared VM boxes,10,Overview,UCaaS,Phone System
Integrated corporate directory,10,Overview,UCaaS,Phone System
Pull corporate directory from AD,Pass/Fail,Overview,UCaaS,Phone System
Add outside phones/numbers to corporate directory,Pass/Fail,Overview,UCaaS,Phone System
Do you support gateways for site survivability,Pass/Fail,Overview,UCaaS,Phone System
Hunt groups,Pass/Fail,Overview,UCaaS,Phone System
Time of day routing for hunt groups,Pass/Fail,Functional Requirements,UCaaS,Phone System
Hoteling/Hot Desking,Pass/Fail,Functional Requirements,UCaaS,Phone System
Single number reach,10,Functional Requirements,UCaaS,Phone System
Multiple DIDs per user (for ACD integration),Pass/Fail,Functional Requirements,UCaaS,Phone System
Number of concurrent call paths per user,10,Functional Requirements,UCaaS,Phone System
Forgerock SSO integration (SAML compliant),10,Functional Requirements,UCaaS,Phone System
Import/provision users from Active Directory,Pass/Fail,Functional Requirements,UCaaS,Phone System
Call detail records,Pass/Fail,Functional Requirements,UCaaS,Phone System
Automated reports,20,Functional Requirements,UCaaS,Phone System
End user account management,10,Functional Requirements,UCaaS,Phone System
Configuration APIs,10,Functional Requirements,UCaaS,Phone System
Bulk admin by CSV/Import,Pass/Fail,Functional Requirements,UCaaS,Phone System
Full admin access for administrators,Pass/Fail,Functional Requirements,UCaaS,Phone System
Create hunt group,10,Functional Requirements,UCaaS,Phone System
MACD users,10,Functional Requirements,UCaaS,Phone System
MACD endpoints,10,Functional Requirements,UCaaS,Phone System
MACD Hunt/IVR,10,Functional Requirements,UCaaS,Phone System
Role based access control for admins,Pass/Fail,Functional Requirements,UCaaS,Phone System
Softphone client,10,Functional Requirements,UCaaS,Phone System
PC support,Pass/Fail,Functional Requirements,UCaaS,Phone System
Mac support,Pass/Fail,Functional Requirements,UCaaS,Phone System
Mobile Client,10,Functional Requirements,UCaaS,Phone System
iPhone,10,Functional Requirements,UCaaS,Phone System
Android,10,Functional Requirements,UCaaS,Phone System
Web based client,10,Functional Requirements,UCaaS,Phone System
Chromium Edge,Pass/Fail,Functional Requirements,UCaaS,Phone System
Chrome support,Pass/Fail,Functional Requirements,UCaaS,Phone System
Hardphone support,Pass/Fail,Functional Requirements,UCaaS,Phone System
Polycom,Pass/Fail,Functional Requirements,UCaaS,Phone System
Cisco,Pass/Fail,Functional Requirements,UCaaS,Phone System
Avaya 9608,10,Functional Requirements,UCaaS,Phone System
"Generic SIP endpoints (Crestron, etc.)",Pass/Fail,Functional Requirements,UCaaS,Phone System
ATA,10,Functional Requirements,UCaaS,Phone System
Automatic Ringdown (PLAR),10,Functional Requirements,UCaaS,Phone System
Internal central notification for 911 calls,10,Functional Requirements,UCaaS,Phone System
e911,10,Functional Requirements,UCaaS,Phone System
Included faxing platform,10,Functional Requirements,UCaaS,Phone System
T.38 faxing support for ATAs,10,Functional Requirements,UCaaS,Phone System
Force outbound caller ID per user,10,Functional Requirements,UCaaS,Phone System
Inbound caller ID name and number,10,Functional Requirements,UCaaS,Phone System
Auto Attendant with call handlers,10,Functional Requirements,UCaaS,Phone System
Logging and reporting of administrative activity,10,Functional Requirements,UCaaS,Phone System
Call quality reporting/troubleshooting,10,Functional Requirements,UCaaS,Phone System
Real Time,10,Functional Requirements,UCaaS,Phone System
Historical,10,Functional Requirements,UCaaS,Phone System
"Per user calling priveleges (LD, international, etc.) - Extension or calling code based",10,Functional Requirements,UCaaS,Phone System
System wide call blocking,Pass/Fail,Functional Requirements,UCaaS,Phone System
Per user incoming call blocking,Pass/Fail,Functional Requirements,UCaaS,Phone System
Office 365,10,Functional Requirements,UCaaS,Phone System
MS Outlook,10,Functional Requirements,UCaaS,Phone System
MS Teams,Pass/Fail,Functional Requirements,UCaaS,Phone System
InContact Integration,10,Functional Requirements,UCaaS,Phone System
Chromium Edge (click to dial),Pass/Fail,Functional Requirements,UCaaS,Phone System
Endpoint support,10,Functional Requirements,UCaaS,Phone System
Provide local numbers,10,Functional Requirements,UCaaS,Phone System
Provide local outbound calling,Pass/Fail,Functional Requirements,UCaaS,Phone System
Port in numbers,Pass/Fail,Functional Requirements,UCaaS,Phone System
Provide toll free numbers,Pass/Fail,Functional Requirements,UCaaS,Phone System
Local emergency services,Pass/Fail,Functional Requirements,UCaaS,Phone System
Phones using local gateways,10,Functional Requirements,UCaaS,Phone System
Total local gateways required,10,Integrations,UCaaS,Phone System
General Company overview,10,Integrations,UCaaS,Phone System
Public or Private Company,10,Integrations,UCaaS,Phone System
2021 revenue & financial Information,10,Integrations,UCaaS,Phone System
Key Acquisitions,10,Integrations,UCaaS,Phone System
Gartner/Forrester/ other analyst information,10,Integrations,UCaaS,Phone System
Referenceable  Clients - Similar Requirements,10,Integrations,UCaaS,Phone System
Proposed data center Address and contact phone number (is to give provide internet providers site info) ,10,Integrations,UCaaS,Phone System
"Please provide details around the ownership of the building that houses the data center.  Is the facility owned or leased?  If it is leased, who holds the lease and what are the terms of the current lease",10,Country Support,UCaaS,Phone System
Year data center constructed,10,Country Support,UCaaS,Phone System
List data center expansions/upgrades (year and nature of work),10,Country Support,UCaaS,Phone System
"List any airfields, nuclear power plants, chemical works, petroleum storage/distillery within a five-mile radius",10,Country Support,UCaaS,Phone System
Confirm proposed data center is outside the 100 year flood plain,10,Country Support,UCaaS,Phone System
"Has the proposed facility been awarded Tier Standards and Certifications by the Uptime Institute?  If so, what were the Tier Standard and Certifications achieved",10,Country Support,UCaaS,Phone System
Describe office Space/Workspace/Workspace recovery options and availability,10,Country Support,UCaaS,Phone System
Describe the process for bringing new equipment into the data center and removing existing equipment from the data center ,10,Country Support,UCaaS,Phone System
Is there a customer staging area,10,Company Information,Data Center,Colocation
Describe any storage facilities that can be utilized for the storage of equipment for a short-term or long-term basis.   Is there a private or communal storage?  What security controls are in place? How long can equipment be stored in communal/private storage areas,10,Company Information,Data Center,Colocation
"Confirm that the facilities do not have any overhead water piping or drainage systems above the proposed raised floor area, telecom rooms, or electrical rooms",10,Company Information,Data Center,Colocation
"Describe facility reporting metrics available to the client either via portal or reports (ticketing, power allocation and draw, network status and utilization, video surveillance, facility status, environmental, cabinet/rack/cage layout visualization, hardware inventory etc.)",10,Company Information,Data Center,Colocation
"Describe your ""remote hands"" support capabilities including hours of availability, languages spoken, resource levels by day/hour, pricing model, technologies supported, and any other relevant information(powering on/off equipment and reporting back information, reading/detailing system output information, ability connect/disconnect power cables, trace/test networking cables/ verify indicator light status etc.)",10,Company Information,Data Center,Colocation
"Provide the height and width of all elevators, doors and hallways along the path from facilities receiving to data center floor",10,Company Information,Data Center,Colocation
"Option A: Confirm the ability to accommodate 400 standard 42U cabinets of contiguous or non contiguous space, if unable to accommodate 400 cabinets how many cabinets can you accommodate currently ",10,Company Information,Data Center,Colocation
Option B: Confirm the ability to accommodate 180 standard 42U cabinets of contiguous or non contiguous space,10,General,Data Center,Colocation
Beyond cabinet requirements in options A and B above please confirm additional space available under right of first refusal ,10,General,Data Center,Colocation
Confirm that a Visio drawing will be included reflecting client cage/space,Info ,General,Data Center,Colocation
Describe contract terms under right of first refusal for cabinet/cage space,Info ,General,Data Center,Colocation
"Detail cage customization options (Biometric access, key pads, custom video surveillance, top/bottom on caging etc.)",Info ,General,Data Center,Colocation
What options exist for overhead ladder rack/cable management (3/4/5 Tiers etc.),Info ,General,Data Center,Colocation
"Do you provide cabinets, if so please describe what manufacture/models are available",Info ,General,Data Center,Colocation
"Are there any limitations on cabinet sizes, if so please describe",10,General,Data Center,Colocation
Do you have any restrictions as to the type of cabinets clients can provide themselves,10,General,Data Center,Colocation
List power utility providers supplying data center,Info ,General,Data Center,Colocation
Describe power distribution design from utility sources to client cabinets,10,General,Data Center,Colocation
What is the proposed Data Centers PUE,Info ,General,Data Center,Colocation
"Describe the current generator configuration (numbers and sizes of the generators, testing schedules etc.)",10,General,Data Center,Colocation
Are there any power system components that do not have at leased N+1 design for redundancy,10,General,Data Center,Colocation
Data center current and future power capacity,Info ,General,Data Center,Colocation
Data center current power utilization,10,Colocation Space,Data Center,Colocation
"Describe power maintenance processes/schedules (generator, UPS, power switching, PDU etc.)",10,Colocation Space,Data Center,Colocation
"Describe how long the Facilities can be operated without power from the service grid with supplies on-hand at the locations.  Include in this response any items that would need to be re-supplied during operation without service from the power service grid, and the frequency and quantity of re-supply required (e.g., fuel, water).",10,Colocation Space,Data Center,Colocation
"Confirm that a monthly report will be generated to show Facility KW usage that includes average KWs per rack, average weekly load by rack and 95% peak-average KWs per rack",Info ,Colocation Space,Data Center,Colocation
How do you monitor power distribution systems/components,Info ,Colocation Space,Data Center,Colocation
Describe power delivery options(metered/dedicated whips etc.),10,Colocation Space,Data Center,Colocation
"What power circuits configurations are available (20A/120V, 30A/120V, 20A/208V, 30A/208V, 50A/208V, 60A/208V, 20A/208V-3P, 30A/208V-3P, 50A/208V-3P and 60A/208V-3P)",10,Colocation Space,Data Center,Colocation
"Do you offer power wholesale pricing, if so what is minimum power commit/consumption",Info ,Colocation Space,Data Center,Colocation
Describe power density maximums per cabinet,Info ,Colocation Space,Data Center,Colocation
"Do you require minimum power commitments, if so please describe in detail",Info ,Colocation Space,Data Center,Colocation
Do you provide managed PDU's for client cabinets,Info ,Power,Data Center,Colocation
Are there any restrictions to clients providing their own PDUs,Info ,Power,Data Center,Colocation
List telecom providers built out in data center,10,Power,Data Center,Colocation
Describe external (carrier facing/peering) network design,10,Power,Data Center,Colocation
Describe internal (client facing) network design,Info ,Power,Data Center,Colocation
Are there any external or internal network components that do not have at least N+1 redundancy,10,Power,Data Center,Colocation
Describe process for ordering and implementing cross connects,10,Power,Data Center,Colocation
"What options are available for cross connects (SMF, CAT6 etc)",10,Power,Data Center,Colocation
"Are you internet neutral in terms of internet circuit providers availability to the site(i.e. no ""favoured providers only"" approach",10,Power,Data Center,Colocation
Please confirm that the proposed data center will maintain an ambient temperature between 65°- 78°F and a relative humidity between 30% and 60%.  The required ambient conditions are referenced to the intake of the computing equipment,Info ,Power,Data Center,Colocation
Describe the method used to prevent overheating during cooling disruption resulting from a utility power outage.,Info ,Power,Data Center,Colocation
"Confirm that all Facility cooling equipment is independently dual-powered, including chillers, heating ventilation and air-conditioning systems (HVACs)",Info ,Power,Data Center,Colocation
Describe your heat dissipation capabilities,Info ,Power,Data Center,Colocation
"If the heat dissipation system is a chilled water system, confirm that the chilled water storage system has the capacity to provide a minimum of seventy-two (72) hours of water in the event of a disruption of standard water delivery.  Describe the plan to augment water supply to keep Facilities operating indefinitely while standard water delivery is impacted",10,Power,Data Center,Colocation
Describe the fire suppression system and fire/smoke detection systems utilized,10,Power,Data Center,Colocation
Describe advanced smoke/carbon detection systems in place such as VESDA,10,Power,Data Center,Colocation
"Describe  the test, validation and inspection processes of the data center fire detection and suppression systems",Info ,Power,Data Center,Colocation
Describe processes/procedures for accessing the data center,Info ,Power,Data Center,Colocation
How are access controls managed and how frequently are access controls reviewed,Info ,Network,Data Center,Colocation
Describe video surveillance/monitoring system(s) for all internal and external access points as well as all critical building systems and the entire raised floor space,Info ,Network,Data Center,Colocation
What is the retention policy for video footage retrieval/playback,Info ,Network,Data Center,Colocation
Confirm that there is security monitoring by personnel on-site 24x7,10,Network,Data Center,Colocation
"Do you conduct independent security tests (network, physical, social engineering)",10,Network,Data Center,Colocation
"List data center standards adherence and compliance certifications (PCI,HIPAA,FISMA,SOC 2/3 etc.)",10,Network,Data Center,Colocation
What assistance is provided for client internal and/or third party audits,10,Network,Data Center,Colocation
Describe the SLA's level for power and how it is measured,10,Environmental,Data Center,Colocation
Describe the SLA's level for network services and how they are measured,10,Environmental,Data Center,Colocation
Describe the SLA's level for cooling and humidity availability and how it is measured,10,Environmental,Data Center,Colocation
Describe the SLA's level for support/ticketing and how it is measured,Info ,Environmental,Data Center,Colocation
"Describe NOC strategy (24/7/365, redundant NOC's, local staffing, remote staffing etc.)",10,Environmental,Data Center,Colocation
Describe Technical Account Management/Advanced support options,10,Environmental,Data Center,Colocation
"Describe your remote hands services at the proposed facility.  What are the hours of availability, resource levels by day/hour, requests support by “remote hands”, pricing model, and any relevant information",10,Environmental,Data Center,Colocation
How do you handle client Inventory management,Info ,Environmental,Data Center,Colocation
Describe your client notification processes for normal and emergency maintenance ,Info ,Security and Compliance,Data Center,Colocation
Describe your account management structure/processes,10,Security and Compliance,Data Center,Colocation
"What is your regular billing cycle (montly/quarterly, in advance/in arrears/both e.g. fixed in advance/variable in arrears)",10,Security and Compliance,Data Center,Colocation
What are your late payment terms,10,Security and Compliance,Data Center,Colocation
Public or Private ,10,Security and Compliance,Data Center,Colocation
2022/2023 revenue & financial Information,Info ,Security and Compliance,Data Center,Colocation
Referenceable  Client Logos,Info ,Security and Compliance,Data Center,Colocation
Wireless / Mobile Services Management ,Info ,Security and Compliance,Data Center,Colocation
"Will the solution support wireless and wirelines invoice processing, dispute management, inventory and reporting from a single portal",10,Security and Compliance,Data Center,Colocation
Invoice & expense management,Info ,Security and Compliance,Data Center,Colocation
Contract management,10,SLA's,Data Center,Colocation
MACD / Order management,10,SLA's,Data Center,Colocation
Does your system have API Integration with Wireless and SaaS Service Providers in the United States ,Info ,SLA's,Data Center,Colocation
"How do you build and maintain inventory (Invoices, EDI, Portals, API Access, CSRs…..) ",10,SLA's,Data Center,Colocation
Do you provide periodic inventory reviews if so at what frequency,Info ,Data Center Support,Data Center,Colocation
Describe how you work with carriers to consolidate accounts ,Info ,Data Center Support,Data Center,Colocation
Does the solution provide the capability to support cost allocation from consolidated bill,10,Data Center Support,Data Center,Colocation
"Does the solution have a way to identify and alert any missing invoices, invoice and inventory discrepancies, if so please describe",Info ,Data Center Support,Data Center,Colocation
Are you able to send an electronic feed with payment and G/L information ,Info ,Data Center Support,Data Center,Colocation
Can you provide Multi-currency allocations and support ,Info ,Account Management,Data Center,Colocation
Can you use and report on GL string allocation/Automation,Info ,Account Management,Data Center,Colocation
Can you implement defined rules and hierarchy of GL String,Info ,Account Management,Data Center,Colocation
Describe your initial invoice Audit Process,Info,Company Information,Expense Management,Mobile
Are monthly invoice charges audited?  Describe how and options ,Info,Company Information,Expense Management,Mobile
"Describe how you handle and report on Dispute, Dispute Tracking and Resolution ",Info,Company Information,Expense Management,Mobile
"At what frequency do you audit services against contract, is this customizable",Info,Company Information,Expense Management,Mobile
"Do you audit and report changes in surcharges, fees, taxes ",Info,Company Information,Expense Management,Mobile
Do you Audit MACD and Disconnected Services if so at what frequency,Info,Company Information,Expense Management,Mobile
"What Optimization Services do you provide? Do you provide cost optimization and cost avoidance recommendations, if so at what frequency",Info,Company Information,Expense Management,Mobile
"Can you provide an initial Cost Optimization and Cost Avoidance Analysis, if so is there an additional cost ",10,Software Module Capabilities,Expense Management,Mobile
Does your system provide benchmark analysis ,10,Software Module Capabilities,Expense Management,Mobile
How do you handle and support cost optimization projects to include savings tracking and disconnect order validation ,10,Software Module Capabilities,Expense Management,Mobile
How are service orders handled? What is required from the client ,10,Software Module Capabilities,Expense Management,Mobile
How are orders tracked to completion and what reporting is provided,10,Software Module Capabilities,Expense Management,Mobile
"How are orders managed through the system to insure that the inventory is updated, the invoices are received, allocated and paid ",10,Software Module Capabilities,Expense Management,Mobile
"Do you provide an order management portal, if so please describe capabilities",10,Service Inventory Build and Maintenance,Expense Management,Mobile
"How do you create and maintain Wireless Services Inventory, specify how you align Client HRIS wireless line assignments to Carrier based reporting ",10,Service Inventory Build and Maintenance,Expense Management,Mobile
How often is the wireless inventory reconciled and reviewed with the client ,10,Service Inventory Build and Maintenance,Expense Management,Mobile
Do you provide line and equipment assignment and remaining term reporting ,10,Service Inventory Build and Maintenance,Expense Management,Mobile
Do you provide ETF charges prior to a disconnect ,10,Service Inventory Build and Maintenance,Expense Management,Mobile
Does your solution perform regular plan and pool optimization for wireless devices?  Is so please explain and provide frequency,10,Service Inventory Build and Maintenance,Expense Management,Mobile
Does your solution provide zero use and inactive employees with active service audits.  Please explain how and frequency,10,Service Inventory Build and Maintenance,Expense Management,Mobile
"Does your solution enable the self service option for the ordering of wireless resources: cellular and data devices, rate planes for voice & data service, accessories and other items through one catalog/portal",10,Service Inventory Build and Maintenance,Expense Management,Mobile
Is the catalog customizable,10,Service Inventory Build and Maintenance,Expense Management,Mobile
Will the solution provide visibility to the end user as to the order status and updates as they occur,10,Audit Services,Expense Management,Mobile
"Can the solution be integrated with major ERP  and IT service management (ITSM ServiceNow) platforms, if so explain functionality and platforms supported",10,Audit Services,Expense Management,Mobile
Will the solution provide workflow for wireless request approvals by designated manager or approver for wireless,10,Audit Services,Expense Management,Mobile
Will the solution support client's business rules to ensure all orders are placed correctly,10,Audit Services,Expense Management,Mobile
"Will the solution show all open, closed and pending orders with the date due and the requested date",10,Audit Services,Expense Management,Mobile
Explain  how availability of mobility devices are provided by service provider at the time of order  ,10,Audit Services,Expense Management,Mobile
Provide a list of the Mobile Carries you have API Integration ,10,Optimization and Savings Recommendations,Expense Management,Mobile
"Do you provide Mobile Help Desk Support, if so provide hours of operations and brief description of support ",10,Optimization and Savings Recommendations,Expense Management,Mobile
"Can you support International Mobile services, If so provide a list of countries and vendors supported ",10,Optimization and Savings Recommendations,Expense Management,Mobile
Can you support Mobile order processing internationally - please describe,10,Optimization and Savings Recommendations,Expense Management,Mobile
Can you support International Mobile Help Desk - please describe ,10,MACD and Order Management ,Expense Management,Mobile
"Do you provide Mobile Depot, device wipe, break fix services ",10,MACD and Order Management ,Expense Management,Mobile
Do you provide MDM support and reporting ,10,MACD and Order Management ,Expense Management,Mobile
How are reports generated and views (manual or system automated),10,MACD and Order Management ,Expense Management,Mobile
What types of reports are available ,10,Wireless/Mobile Support,Expense Management,Mobile
How often is reported information updated ,10,Wireless/Mobile Support,Expense Management,Mobile
Can your system provide Executive and Functional Dashboards (manual or system automated) ,10,Wireless/Mobile Support,Expense Management,Mobile
Can reports be exported and if so into what file formats,10,Wireless/Mobile Support,Expense Management,Mobile
Confirm you provide Invoice and Month over Month Spend by Service Provider ,10,Wireless/Mobile Support,Expense Management,Mobile
