Question,Default Weight,Category,Opportunity Type,Opportunity Subtypes
Confirm you provide order and dispute tracking reports ,10,Wireless/Mobile Support,Expense Management,Mobile
Will the solution provide drill-down dashboards and reports?,10,Wireless/Mobile Support,Expense Management,Mobile
Provide a description of Account and Service Support listing out the typical team member structure  ,10,Wireless/Mobile Support,Expense Management,Mobile
"What is the weekly, monthly and quarterly meeting cadence ",10,Wireless/Mobile Support,Expense Management,Mobile
How do you manage client request and issue management ,10,Wireless/Mobile Support,Expense Management,Mobile
Will you provide contact information including call in support ,10,Wireless/Mobile Support,Expense Management,Mobile
Will you provide Business Reviews and Executive Reporting ,10,Wireless/Mobile Support,Expense Management,Mobile
How are savings defined ,10,Wireless/Mobile Support,Expense Management,Mobile
"How are savings tracked, reported and validated to bill",10,Wireless/Mobile Support,Expense Management,Mobile
Do you provide a savings guarantee,10,Wireless/Mobile Support,Expense Management,Mobile
What SLAs are provided? Do you include any financial penalties for non-compliance ,10,Wireless/Mobile Support,Expense Management,Mobile
Please provide a current SOC 2 Type 2 Report or other similar audit report? ,10,Wireless/Mobile Support,Expense Management,Mobile
Please provide a copy of your most recent audit report,10,Wireless/Mobile Support,Expense Management,Mobile
Please provide a typical implementation timeline and requires ,10,Wireless/Mobile Support,Expense Management,Mobile
Global Capabilities,10,Wireless/Mobile Support,Expense Management,Mobile
How do you integrate with HCM systems such as HRIS? What is the degree of ease of management,10,Wireless/Mobile Support,Expense Management,Mobile
List HCM and HRIS systems supported,10,Reporting,Expense Management,Mobile
"How do you integrate with SNOW, other client based applications and who owns the catalog",10,Reporting,Expense Management,Mobile
How would you integrate and support client Tier 1 support helpdesk ,10,Reporting,Expense Management,Mobile
"Describe your capabilities surrounding removing workload from internal Client  staff, how does your platform solve for this. Describe in detail",10,Reporting,Expense Management,Mobile
Can you provide Benchmarking and Contract Negotiation Support as one off projects for both Mobile and Wireline services globally,10,Reporting,Expense Management,Mobile
"Describe your mobile services Global Capabilities (See Scope Tab for Equinix Regions, confirm Countries and Providers are supported) ",10,Reporting,Expense Management,Mobile
"Can you provide Dynamic Plan Changes inside a billing cycle? If so, please provide a brief description.",10,Reporting,Expense Management,Mobile
Can you describe in detail how your platform integrates with ServiceNow,10,Reporting,Expense Management,Mobile
"For customer portal and order placement, is your ServiceNow a true integration or a punch out model",10,Business Reviews and Account Support,Expense Management,Mobile
"How much time/level of effort will be required from the Equinix team for  ServiceNow for integration, implementation and in life cycle? Equinix wants to see the amount of time in “black and white”. What additional information is needed for you to provide this?",10,Business Reviews and Account Support,Expense Management,Mobile
"Please describe how you will support Mobile Device Purchase by Equinix End Users, can you support Equinix employee purchases or partial purchase/upgraded device scnenarios? How do you handle Equinix employee credit card transactions? ",10,Business Reviews and Account Support,Expense Management,Mobile
Do you outsource or use any 3rd party support or are all you support services badged employees,10,Business Reviews and Account Support,Expense Management,Mobile
Where are your support resources located,10,Business Reviews and Account Support,Expense Management,Mobile
What languages can you support for both calls and written communications,10,Savings Tracking,Expense Management,Mobile
Can you provide Mobile Contract negotiations?  Please provide a list of countries and providers.  Are there any additional cost for this service? If there are additional costs please describe in detail IE per carrier engagement etc. ,10,Savings Tracking,Expense Management,Mobile
Can you provide Mobile Services Benchmarking? If so please describe,10,Savings Tracking,Expense Management,Mobile
Equinix is requesting that each provider provide a savings analysis and projected savings based on a US based demand set. What information do you request and how long will this take to get turned around,Info,SLAs,Expense Management,Mobile
Need to fully understand how you will Optimize savings for the non-US / Canadian Carriers and if savings are possible and can they be tracked,10,Other,Expense Management,Mobile
What is required for you to offer a Savings Guarantee,10,Other,Expense Management,Mobile
"Do you manage customer switching, routing, firewalls and wifi networking? What platforms are supported? ",10,Other,Expense Management,Mobile
"Please rate your professional services capabilities in each of these areas as either none, basic, or strong",10,Other,Expense Management,Mobile
*Guidance/application of IT best practices ,10,Other,Expense Management,Mobile
"*Implementation/configuration of sharepoint, configuring sites, applying governance, identity/access management, MFA etc. ",10,Other,Expense Management,Mobile
*Migration of NAS/file data to O365 Sharepoint and MS Teams?,10,Other,Expense Management,Mobile
*Ongoing management of O/M 365 suite of applications to include  Teams/Sharepoint and other applications,10,Other,Expense Management,Mobile
,10,Other,Expense Management,Mobile
"For broadband circuits, do you have your own agreements with local carriers, or do you leverage an aggregator?",10,Other,Expense Management,Mobile
How many direct provider contracts do you have in the US?,10,Other,Expense Management,Mobile
"Do you have ebonding with a majority of your carriers, or do you have to phone in support requests?",10,Additional Provider Questions,Expense Management,Mobile
"Will you provide an SLA for circuit installation for new store openings? If so, what SLA?",10,Additional Provider Questions,Expense Management,Mobile
Do you offer unlimited 5G wireless (with no throttling/caps) as an option for primary connectivity? Which carriers?,10,Additional Provider Questions,Expense Management,Mobile
"For backup LTE/5G, do you pool data across carriers? Which carriers?",10,Additional Provider Questions,Expense Management,Mobile
"*Implementation/configuration of Identity and access management, Single Sign On and Multi-Factor Authentication",10,Additional Provider Questions,Expense Management,Mobile
*Implementation/configuration of on prem or Azure Active Directory,10,Additional Provider Questions,Expense Management,Mobile
*Network design and architecture,10,Additional Provider Questions,Expense Management,Mobile
*Database administration,10,Additional Provider Questions,Expense Management,Mobile
*Onsite installation (Rack and stack),10,Additional Provider Questions,Expense Management,Mobile
*Server deployment (physical or virtual),10,Additional Provider Questions,Expense Management,Mobile
*On premise storage/SAN/NAS,Info,Additional Provider Questions,Expense Management,Mobile
*Software Development,Info,Additional Provider Questions,Expense Management,Mobile
*IT Security assessments,10,Additional Provider Questions,Expense Management,Mobile
*Compliance,10,Network Managed Services,Managed Service Provider,
Describe help desk offering(s) in detail. ,10,Network Managed Services,Managed Service Provider,
Do you manage/support end user applications? If so please list supported apps. ,10,Network Managed Services,Managed Service Provider,
What hours are your help desk staffed?,10,Network Managed Services,Managed Service Provider,
What are your help desk locations? Are all staff US based?,10,Network Managed Services,Managed Service Provider,
"How can clients access support, ticketing systems, phone, chat, email?",10,Network Managed Services,Managed Service Provider,
Can you provide onsite support?  Site list to be shared.,10,Network Managed Services,Managed Service Provider,
Do you offer white-glove/premier help desk services?,10,Network Managed Services,Managed Service Provider,
Do you staff all support tiers 24/7 or do you have to escalate to on call resources during some hours?,10,Network Managed Services,Managed Service Provider,
"What reporting do you offer? I.e. Actionanble, Executive.",10,Network Managed Services,Managed Service Provider,
What are your SLA's for Help Desk?,10,Network Managed Services,Managed Service Provider,
Do you manage desktop/laptop operating systems? List operating systems supported.,10,Network Managed Services,Managed Service Provider,
What endpoint management tools are leveraged/supported?,10,Network Managed Services,Managed Service Provider,
"Do you manage peripherals (printers, scanners etc.)?",10,Network Managed Services,Managed Service Provider,
Do you offer hardware/software lifecycle management? If so please describe capabilities. ,10,Network Managed Services,Managed Service Provider,
Do you manage on prem/Azure Active Directory?,10,Project Work,Managed Service Provider,
Do you offer onging management of cloud o365 email/apps? Describe services in detail. ,10,Project Work,Managed Service Provider,
"Do you offer/manage SSO, Identity Mgmt solutions? If so describe in detail.",10,Project Work,Managed Service Provider,
Do you support/manage Sharepoint and MS Teams? Please describe services in detail.  ,10,Project Work,Managed Service Provider,
Do you offer wharehousing and inventory management of customer devices such as laptop/tablets etc.,10,Project Work,Managed Service Provider,
Do you offer staging/standard imaging and  deployment of end user devices?,10,AWS,Managed Service Provider,
Describe remote support capabilities/methodology. What tools are used?,10,AWS,Managed Service Provider,
Do you offer managed NAS services? What platforms are supported (Synology?),10,AWS,Managed Service Provider,
"Do you offer patch management? Describe tools used, methodology and supported platforms. ",10,AWS,Managed Service Provider,
Do you manage customer owned hardware? Will you engage directly with manufacturer for break-fix/RMA's? List platforms supported. ,10,Infrastructure Managed Services,Managed Service Provider,
Do you support/manage voice systems (UCaaS/On Prem Cisco etc.)? List platforms supported. ,10,Infrastructure Managed Services,Managed Service Provider,
Do you support managing VMware?,10,Infrastructure Managed Services,Managed Service Provider,
Do you support data backup? Servers and endpoints? Please describe.  ,10,Infrastructure Managed Services,Managed Service Provider,
Do you manage applications? Describe/list applications supported.,10,Circuit Aggregation,Managed Service Provider,
What are your SLA's for hardware/infrastructure/endpoint management?,10,Circuit Aggregation,Managed Service Provider,
"What reporting do you offer? I.e. Actionable, Executive.",10,Circuit Aggregation,Managed Service Provider,
Number of clients in the financial vertical,10,Circuit Aggregation,Managed Service Provider,
Please list your NOC locations and approximate staffing levels,10,Circuit Aggregation,Managed Service Provider,
Do you have a SOC2 Type 2 that can be shared under NDA,10,Circuit Aggregation,Managed Service Provider,
Do you include patching in your managed network services?,10,Project Work,Managed Service Provider,
Patching frequency,10,Project Work,Managed Service Provider,
Is out of schedule emergency patching for critical security patches included?,10,Project Work,Managed Service Provider,
"Are major version updates included, or only minor updates?",10,Project Work,Managed Service Provider,
Can patch schedules be dictated/customized to client needs?,10,Project Work,Managed Service Provider,
"VMware, Server/Desktop OS, Network devices such as firewalls, switches routers? What platform(s) do you use for patching?",10,Project Work,Managed Service Provider,
Do you include onsite support for hardware issues/replacement?,10,Project Work,Managed Service Provider,
Do you coordinate with manufacturers for hardware replacement on bahalf of the customer?,10,Project Work,Managed Service Provider,
What is your SLA for P1 remote support?,10,Project Work,Managed Service Provider,
What is your SLA for onsite support if needed?,10,Project Work,Managed Service Provider,
Do you support Cisco Catalyst and Aironet? What is your Cisco partner level?,10,Help Desk,Managed Service Provider,
Do you support Meraki Switching and APs? What is your partner level?,10,Help Desk,Managed Service Provider,
Do you support Cato Networks? What is your partner level?,10,Help Desk,Managed Service Provider,
"If Lighthouse choses to move to a model in the future where you provide the hardware as a monthly service cost, what hardware brands do you support in this model?",10,Help Desk,Managed Service Provider,
"Can you offer a persistent resource model for a client of this size (not dedicated, but a small number of engineers they would consistenty work with who would know their environment?",10,Help Desk,Managed Service Provider,
What primary monitoring tool does your NOC use for network? Would Lighthouse have access to this tool?,10,Help Desk,Managed Service Provider,
How many Azure certified engineers/architects do you have on staff?,10,Help Desk,Managed Service Provider,
"Do you support Azure specific features (autoscaling, RDS, etc.), or just basic infrastructure (VMs, network, storage)",10,Help Desk,Managed Service Provider,
Do you manage the OS?,10,Help Desk,Managed Service Provider,
Do you manage applications?,10,Help Desk,Managed Service Provider,
Do you provide Microsoft licensing as CSP? Are there advantages to using your services for licensing such as reduced price and/or premier support?,10,Help Desk,Managed Service Provider,
Do you manage M365 suite? If so describe service offering. ,10,Infrastructure/Hardware/Endpoint,Managed Service Provider,
What is  Microsoft partner Status?,10,Infrastructure/Hardware/Endpoint,Managed Service Provider,
Do you have Microsoft Modern Workforce expertise? If so describe. ,10,Infrastructure/Hardware/Endpoint,Managed Service Provider,
Do you manage desktop/laptop and server operating systems? List operating systems supported.,10,Infrastructure/Hardware/Endpoint,Managed Service Provider,
Do you support HPE Alterris SANs? What is your partner level?,10,Infrastructure/Hardware/Endpoint,Managed Service Provider,
Do you support HPE Servers? What is your partner level?,10,Infrastructure/Hardware/Endpoint,Managed Service Provider,
What are your options for HPE provided hardware replacement (RMA) for failed devices to include HPE resources managing replacement?,10,Infrastructure/Hardware/Endpoint,Managed Service Provider,
What endpoint management tools do you use?,10,Infrastructure/Hardware/Endpoint,Managed Service Provider,
Do you support/manage virtual infrastructure (VMware etc.)? List supported platforms. ,10,Infrastructure/Hardware/Endpoint,Managed Service Provider,
Can you support/manage AIX systems?,10,Infrastructure/Hardware/Endpoint,Managed Service Provider,
Do you manage/support Microsoft Active Directory and Microsoft EntraID? Describe service offerings.,10,Infrastructure/Hardware/Endpoint,Managed Service Provider,
"Can you offer co-lo to host 1 rack of infrastructure (AIX, routers, etc.). If so, what locations and what Data Center providers?",10,Infrastructure/Hardware/Endpoint,Managed Service Provider,
"Do you offer data protection or ""data backup""? If so describe service offering(s)",10,Infrastructure/Hardware/Endpoint,Managed Service Provider,
Describe reporting available for data backup and DR services. ,10,Infrastructure/Hardware/Endpoint,Managed Service Provider,
Do you offer customizable data retention? ,10,Infrastructure/Hardware/Endpoint,Managed Service Provider,
Do you offer both onsite data storage as well as off premise/Cloud based data storage for backup data?,10,Infrastructure/Hardware/Endpoint,Managed Service Provider,
Do you support data backup/DR for virtual machines and AIX systems? List supported platforms.,10,Infrastructure/Hardware/Endpoint,Managed Service Provider,
Can clients perform self service restores of data?,10,Infrastructure/Hardware/Endpoint,Managed Service Provider,
Can you setup/Manage DR to Azure from our on prem datacenter?,10,Infrastructure/Hardware/Endpoint,Managed Service Provider,
What RPO's and RTO's are supported for DR?,10,Infrastructure/Hardware/Endpoint,Managed Service Provider,
Do you provide a DR runbook for both testing and failover events? If so please describe. ,10,Company Information,Managed Service Provider,
"How many DR tests, per year, are included by default? Can additional tests be added?",10,Company Information,Managed Service Provider,
Does your annual BC/DR testing include full production run from the DR site and failback?,10,Company Information,Managed Service Provider,
How many staff are on the help desk Lighthouse would call into?,10,Network Manages Services,Managed Service Provider,
"Is the desk staffed 24/7? If so, are all ticket types handled 24/7, or only certain types?",10,Network Manages Services,Managed Service Provider,
SLAs for response,10,Network Manages Services,Managed Service Provider,
Can you support Jack Henry financial software?,10,Network Manages Services,Managed Service Provider,
"Platforms you support ""out of the box""",10,Network Manages Services,Managed Service Provider,
Will you support other customer platforms given a runbook or vendor support contract?,10,Network Manages Services,Managed Service Provider,
Can you support a full bi-directional integration with Jira so our employees remain in our system?,10,Network Manages Services,Managed Service Provider,
What voice/UC platforms do you manage/support?,10,Network Manages Services,Managed Service Provider,
Do you offer onging management of cloud o365 email/apps? Describe services in detail.,10,Network Manages Services,Managed Service Provider,
"Do you offer MDR services on Crowdstrike? If not, what platforms do you support?",10,Network Manages Services,Managed Service Provider,
What are your SLAs for response/action for a tool identified issue?,10,Network Manages Services,Managed Service Provider,
"Do you perform proactive threat hunting? If so, is there a specific cadence to this?",10,Network Manages Services,Managed Service Provider,
"Do you offer vulnerability management? If so, what tool do you use?",10,Network Manages Services,Managed Service Provider,
Does your vulnerability management program include remediation?,10,Network Manages Services,Managed Service Provider,
Do you offer phishing/cybersecurity awareness training?,10,Network Manages Services,Managed Service Provider,
Do you provide system hardening services?,10,Network Manages Services,Managed Service Provider,
What firewall platforms do you manage/support?,10,Network Manages Services,Managed Service Provider,
"Do you manage/support NextGen FW functions such as DLP, Content Filtering, Application Control, IDS/IPS etc.? ",10,Network Manages Services,Managed Service Provider,
"Will you handle proactive patch management for all PCs, servers, and infrastructure? What tool do you use? Do you offer SLA compliance? Are third party applications included?",10,Azure/M365,Managed Service Provider,
"Do you provide an IDP platform (Okta, etc.)",10,Azure/M366,Managed Service Provider,
How would you manage user provisioning/deprovisioning? Do you employ automation such as SCIM or Miscrosoft Autopilot?,10,Azure/M367,Managed Service Provider,
Will you handle PC procurement/turn up/turn down?,10,Azure/M368,Managed Service Provider,
Can you inventory hardware for new employee onboarding?,10,Azure/M369,Managed Service Provider,
"Do you manage Intune for end point management, policy enforcement, application control, user managemente etc?",10,Azure/M370,Managed Service Provider,
Do provide OS image management? If so please describe.,10,Azure/M371,Managed Service Provider,
Will you handle onboarding new applications to the IAM and SSO applications?,10,Azure/M372,Managed Service Provider,
How do you handle hardware lifecycle management?,10,Infrastructure Managed Services,Managed Service Provider,
Will you maintain our ITAM DB?,10,Infrastructure Managed Services,Managed Service Provider,
Do you manage warranty renewals?,10,Infrastructure Managed Services,Managed Service Provider,
Do you handle hardware recycling?,10,Infrastructure Managed Services,Managed Service Provider,
Can you provide a certificate of destruction for any decommissioned hardware?,10,Infrastructure Managed Services,Managed Service Provider,
"If none of your existing carriers can support a site, will you sign a new provider or resell a retail circuit to support client?",10,Infrastructure Managed Services,Managed Service Provider,
Do you pass through construction funding from the providing carrier?,10,Infrastructure Managed Services,Managed Service Provider,
"Do you offer Starlink? If so, are you a direct authorized reseller? If not, whose service are you reselling?",10,Infrastructure Managed Services,Managed Service Provider,
Who do you partner with for onsite support? Do they employ W2 technicians or 1099 contractors?,10,Infrastructure Managed Services,Managed Service Provider,
Do you support Cradlepoint? What is your partner level?,10,Infrastructure Managed Services,Managed Service Provider,
Do you support Meraki APs? What is your partner level?,10,Infrastructure Managed Services,Managed Service Provider,
Do you support Fortinet Firewalls? What is your partner level?,10,Infrastructure Managed Services,Managed Service Provider,
Are you willing to provide best effort support on unmanaged (NetGear) switches (talk LCON through troubleshooting),10,BC/DR,Managed Service Provider,
"If Client choses to move to a model in the future where you provide the hardware as a monthly service cost, which hardware brands do you support in this model?",10,BC/DR,Managed Service Provider,
Do you offer a branch voice solution (UCaaS)?,10,BC/DR,Managed Service Provider,
"Can you customise your support model to fit the client preferences? Specifically, can you offer a hybrid model with some persistent resources?",10,BC/DR,Managed Service Provider,
What primary monitoring tool does your NOC use for network? Would Client have access to this tool?,10,BC/DR,Managed Service Provider,
Are you willing to work directly within the Client's (ZenDesk) ticketing system?,10,BC/DR,Managed Service Provider,
Can you integrate with the Client's ticketing system (ZenDesk) for bi-directional ticket mangement?,10,BC/DR,Managed Service Provider,
"What is your standard support model for a client of this size? (Shared Services, Pod, Fully Dedicated Resources). Please note if this is an elite or higher tier NOC than your smaller clients are supported by.",10,BC/DR,Managed Service Provider,
Do you have a tool to give the Client's visibility and ability to manage their portfolio of connections? What information does this include? Circuit ID? Contract End Date? Costs? Can circuits be added to this tool that you do not procure?,10,BC/DR,Managed Service Provider,
How do you track project status during implementations and communicate that with Sun?,10,BC/DR,Managed Service Provider,
"Is your support fully staffed 24/7 for all incident types? If not, please provide the breakdown.",10,BC/DR,Managed Service Provider,
How late (and in which time zone) can you ship replacement hardware out? How early does an issue need to be identified to ship replacement equipment same day.,10,BC/DR,Managed Service Provider,
Will you provide a consistent implementation team for all installs? Would this include PM and engineer?,10,BC/DR,Managed Service Provider,
"Will you commit to an executive sponsor for this project? If so, who would that be?",10,BC/DR,Managed Service Provider,
Will your installation techs perform circuit testing during installation based on client guidelines?,10,Feet on the Street,Managed Service Provider,
"Please explain your Account Management approach, including how you will structure the account executive and subordinates to fully support the Sun portfolio.  Where will this Account Executive be located?",10,Feet on the Street,Managed Service Provider,
Sun requires quarterly business reviews. Please describe the metrics and agenda that you would typically use to support these meetings.,10,Feet on the Street,Managed Service Provider,
"Please provide a copy of the escalation hierarchy that Customer would currently have access to, from both a NOC and account management perspective, including executive sponsorship.",10,Feet on the Street,Managed Service Provider,
Would you commit to weekly meetings to discuss project status and update project documentation?,10,Feet on the Street,Managed Service Provider,
"Describe how billing works – assume centralized, nothing sent to site address.  All connections should roll up under one single master account and contact point for billing. Preference is also to bucket services/hardware/onsite seperately. Please confirm if this is possible.",10,Feet on the Street,Managed Service Provider,
"If none of your existing carriers can support a site, will you sign a new provider or resell a retail circuit to support QSR?",10,Tier 1 Help Desk,Managed Service Provider,
