Question,Default Weight,Category,Opportunity Type,Opportunity Subtypes
Company Name,Info,Overview,All,All
Year Founded,10,Overview,All,All
Headquarters,Info,Overview,All,All
Ownership,Info,Overview,All,All
Parent Company,Info,Overview,All,All
Number of Clients/Endpoints,10,Overview,All,All
Referenceable Clients,10,Overview,All,All
Number of Employees,10,Overview,All,All
Gartner/Forrester/Other Analyst Information,Info,Overview,All,All
Where are you NOCs/SOCs located?,10,Overview,Managed Service Provider,All
Do you have a SOC2 Type 2 report that can be shared under NDA?,10,Overview,Managed Service Provider,All
List the industry certifications held by your staff.,10,Overview,Managed Service Provider,All
Describe your help desk offering in detail,Info,Help Desk,Managed Service Provider,
How many help desk support personal do you have employed?,10,Help Desk,Managed Service Provider,
List the end user applications that you support out of the box.,10,Help Desk,Managed Service Provider,
What hours is your help desk staffed excluding ‘on call?’,10,Help Desk,Managed Service Provider,
List your help desk locations.,10,Help Desk,Managed Service Provider,
List all channels for the client to contact the help desk.,10,Help Desk,Managed Service Provider,
Can you provide onsite help desk support?,10,Help Desk,Managed Service Provider,
Do you staff all support tiers 24/7/365 excluding on-call?,10,Help Desk,Managed Service Provider,
Do you provide an on-call service?,10,Help Desk,Managed Service Provider,
What reporting do you offer and how frequently?,10,Help Desk,Managed Service Provider,
What are your response and resolution SLAs for the help desk?,10,Help Desk,Managed Service Provider,
"Will you manage customer owned switching, routing, firewalls and wifi networking? What platforms are supported? ",,Managed Infrastructure,Managed Service Provider,
Do you manage SD-WAN environments? Which platforms do you support/recommend?,,Managed Infrastructure,Managed Service Provider,
Do you support/manage LTE circuit devices such as Peplink or Craddlepoint?,,Managed Infrastructure,Managed Service Provider,
Do you provide circuit monitoring and support? ,,Managed Infrastructure,Managed Service Provider,
"Do you engage directly with circuit carriers for ticket management, troubleshooting and problem resolution?",,Managed Infrastructure,Managed Service Provider,
Do you include onsite support for network hardware issues/replacement?,,Managed Infrastructure,Managed Service Provider,
What are your SLA's remote support?,,Managed Infrastructure,Managed Service Provider,
What are your SLA's for onsite support if needed? How do you charge for onsite support?,,Managed Infrastructure,Managed Service Provider,
Are you willing to provide best effort support on unmanaged/on premise infrastructure (talk LCON through troubleshooting),,Managed Infrastructure,Managed Service Provider,
"If customer chooses to move to a model in the future where you provide the hardware as a monthly service cost, what hardware platforms do you support in this model?",,Managed Infrastructure,Managed Service Provider,
What primary monitoring tool does your NOC use for network? Would customer have access to this tool?,,Managed Infrastructure,Managed Service Provider,
Do you include proactive capacity and EOL/EOS management as part of your offering?,,Managed Infrastructure,Managed Service Provider,
Are you willing to work directly within customers ticketing system?,,Managed Infrastructure,Managed Service Provider,
"Describe your methodogy for implementing new deployments of LAN/WAN environments (switching, routing, SDWAN, Wifi, cabling etc)",,Managed Infrastructure,Managed Service Provider,
Can you integrate with customers ticketing system for bi-directional ticket mangement?,,Managed Infrastructure,Managed Service Provider,
Describe your DRaaS service offering(s),10,DRaaS Features and Service Offerings ,Cloud,DRaaS
How many DRaaS clients do you currently support,10,DRaaS Features and Service Offerings ,Cloud,DRaaS
How many total systems are you protecting via your DRaaS offerring,10,DRaaS Features and Service Offerings ,Cloud,DRaaS
"What are your supported RPO(s), can you support 4 hr and 2 hr RPO(s)",10,DRaaS Features and Service Offerings ,Cloud,DRaaS
What are your supported RTO(s),10,DRaaS Features and Service Offerings ,Cloud,DRaaS
Do you provide services/solutions that provide hot standby/active-active processing (Zero RPO/RTO),10,DRaaS Features and Service Offerings ,Cloud,DRaaS
What recovery locations are available,10,DRaaS Features and Service Offerings ,Cloud,DRaaS
"How do you charge for DRaaS, how do you charge for vCPU/vRAM/Storage and do you have tiered pricing where costs go down as quantities go up",10,DRaaS Features and Service Offerings ,Cloud,DRaaS
What technologies do you leverage for replication/orchestration,10,DRaaS Features and Service Offerings ,Cloud,DRaaS
How many DR tests are included in offering by default and can additional tests be added,10,DRaaS Features and Service Offerings ,Cloud,DRaaS
"Do you provide an initial DR ""test"" during implementation in order to validate solution functionality and if so does this count against test built into service offerring ",10,DRaaS Features and Service Offerings ,Cloud,DRaaS
"Are there any fees/charges associated with ""failing back"" after a fail over and are there any caveats regarding the failover process",10,DRaaS Features and Service Offerings ,Cloud,DRaaS
"Do you have a portal that allows clients to view protected systems, monitor and manage DRaaS",10,DRaaS Features and Service Offerings ,Cloud,DRaaS
Do you offer recovery to multi-tenant cloud,10,DRaaS Features and Service Offerings ,Cloud,DRaaS
Do you offer recovery to private cloud,10,DRaaS Features and Service Offerings ,Cloud,DRaaS
Do you offer recovery to Azure/AWS/GCP or other cloud providers,10,DRaaS Features and Service Offerings ,Cloud,DRaaS
"Do you support recovery to hybrid cloud, combination of customer owned gear and provider infrastructure ( customer owned Firewalls/switches/physical server etc with provider multi-tenant / private cloud recovery environment)",10,DRaaS Features and Service Offerings ,Cloud,DRaaS
How does your service provide for failover of public facing applications such as web applications,10,DRaaS Features and Service Offerings ,Cloud,DRaaS
"Does your DRaaS offering include a DR runbook/playbook, if so what is your methodology for keeping it up to date",10,DRaaS Features and Service Offerings ,Cloud,DRaaS
Do you have a maximum size limitation for virtual machines being protected (#vCPU/vRAM/Storage),10,DRaaS Features and Service Offerings ,Cloud,DRaaS
Do you offer multiple tiers of storage for DR recovery,10,DRaaS Features and Service Offerings ,Cloud,DRaaS
"Do you offer an assessments in order to determine application/system interdependencies, network requirements etc. If so is this done in house or via 3rd party",10,DRaaS Features and Service Offerings ,Cloud,DRaaS
"Do you support protection of virtual appliances, open source operating systems and Windows server OS's, provide support matrix if possible",10,DRaaS Features and Service Offerings ,Cloud,DRaaS
"Do you have multiple NOC's, if so please list locations ",10,Support,Cloud,DRaaS
"What is your support model/methodology ( IE follow the sun, 24x7 with one centralized NOC etc)",10,Support,Cloud,DRaaS
Do you have dedicated DRaaS engineers supporting your DRaaS service ( Monitoring/Break-fix/Testing/ Failover),10,Support,Cloud,DRaaS
Do you have a dedicated disaster recovery team / engineers,10,Support,Cloud,DRaaS
Is support staff 100% U.S. based,10,Support,Cloud,DRaaS
Do you offer Phone/Portal-Ticketing/Chat support options,10,Support,Cloud,DRaaS
Do you offer Technical Account Management service,10,Support,Cloud,DRaaS
Do you have premier support options ( IE persistent support engineering resources) ,10,Support,Cloud,DRaaS
Do you have a support model where engineering/support resources are either dedicated or persistent,10,Support,Cloud,DRaaS
Ratio of support engineers to total staff,10,Support,Cloud,DRaaS
"What are your SLA's for Disaster Recovery (RPO/RTO, Time to bring protected systems online after decleration etc.)",10,Service Level Agreements,Cloud,DRaaS
"SSAE 16 SOC I/II/III, PCI DSS, HIPAA, HiTRUST, GDPR, FedRamp, FISMA etc, please list",10,Compliance,Cloud,DRaaS
Do you have a dedicated compliance team,10,Compliance,Cloud,DRaaS
Do you assist client with audits,10,Compliance,Cloud,DRaaS
Do you have 24/7/365 staffed NOC,10,Support,Cloud,DRaaS
Do you have multiple NOC's (list locations) ,10,Support,Cloud,DRaaS
"Is support US based, offshore, hybrid, if offshore list locations",Info,Support,Cloud,DRaaS
24/7/365 support for cloud services,10,Support,Cloud,DRaaS
"Do you have premier support options ( IE persistent support engineering resources, dedicatd support options) ",10,Support,Cloud,DRaaS
"What support KPI's do you track (Ticket response times, resolution times, phone hold times etc.) Can you share the KPI numbers?",10,Support,Cloud,DRaaS
"How do you track client support satisfaction, NPS etc.?",10,Support,Cloud,DRaaS
Ratio of support engineers to total staff / Ratio of support engineers to clients,10,Support,Cloud,DRaaS
"What client interaction options do you have (phone,ticketing,chat etc.)",10,Support,Cloud,DRaaS
What is your mean time to answer support request,10,Support,Cloud,DRaaS
What is your mean time to resolution,10,Support,Cloud,DRaaS
What technology certifications do your support engineers hold/how many engineers are certififed,10,Support,Cloud,DRaaS
Do you support ebonding with Service Now,10,Support,Cloud,DRaaS
How do you communicate change management/maintenance windows to clients,10,Support,Cloud,DRaaS
Internet Bandwidth ,10,SLAs,Cloud,DRaaS
Multi-Tenant Cloud,10,SLAs,Cloud,DRaaS
Private Cloud,10,SLAs,Cloud,DRaaS
Backup ,10,SLAs,Cloud,DRaaS
Disaster Recovery,10,SLAs,Cloud,DRaaS
"Data center services (power,cooling)",10,SLAs,Cloud,DRaaS
Do you offer VMware multi-tenant Cloud,Info,Vmware: Multi-Tenant/Private Cloud,Cloud,DRaaS
Do you offer VMware private cloud Cloud,Info,Vmware: Multi-Tenant/Private Cloud,Cloud,DRaaS
Briefly describe Private cloud platform(s),10,Vmware: Multi-Tenant/Private Cloud,Cloud,DRaaS
Briefly describe Multi-Tenant cloud platform,10,Vmware: Multi-Tenant/Private Cloud,Cloud,DRaaS
List locations/geographies where you offer Private and Multi-Tenant cloud services,Info,Vmware: Multi-Tenant/Private Cloud,Cloud,DRaaS
"Do you offer a portal for customer management of cloud resources ( deploy vm, change virtual hardware, shutdown/power on, clone vm, templates, view resource utilization etc.)",10,Vmware: Multi-Tenant/Private Cloud,Cloud,DRaaS
Do you leverage VMware VCD,Info,Vmware: Multi-Tenant/Private Cloud,Cloud,DRaaS
"Does your multi-tenant and/or private cloud  offer VMware NSX features, please list",10,Vmware: Multi-Tenant/Private Cloud,Cloud,DRaaS
List options for hyper-converged  Private Cloud,Info,Vmware: Multi-Tenant/Private Cloud,Cloud,DRaaS
"Do you offer shared storage options, if so please list tiers and associated performance levels",10,Vmware: Multi-Tenant/Private Cloud,Cloud,DRaaS
Published API for orchestration,10,Vmware: Multi-Tenant/Private Cloud,Cloud,DRaaS
"Monitoring/alerting ( up/down, vCPU utilization, memory utilization, file system utilization, processes , apps etc)",10,Vmware: Multi-Tenant/Private Cloud,Cloud,DRaaS
Do you offer cloud readiness assessment for VMware based multi-tenant/private cloud,10,Vmware: Multi-Tenant/Private Cloud,Cloud,DRaaS
Do you offer migration assistance from customer premise (VMware) workloads? If so please explain capabilities,10,Vmware: Multi-Tenant/Private Cloud,Cloud,DRaaS
"Can customers co-manage or have read only access to aspects of cloud services (Firewall/Load Balancer/vCenter etc.), if so please list components that can be co-managedor have RO access",10,Vmware: Multi-Tenant/Private Cloud,Cloud,DRaaS
How do you charge for multi-tenant cloud,10,Vmware: Multi-Tenant/Private Cloud,Cloud,DRaaS
How do you charge for private cloud,10,Vmware: Multi-Tenant/Private Cloud,Cloud,DRaaS
Do you support hybrid cloud (Multi-tenant and private cloud connected via layer 2),10,Vmware: Multi-Tenant/Private Cloud,Cloud,DRaaS
"Describe your connectivity options to Azure, AWS and GCP",10,Network,Cloud,DRaaS
"Latencies (DC to DC, DC to Azure/AWS/GCP)",Info,Network,Cloud,DRaaS
What load balancing options to you offer,10,Network,Cloud,DRaaS
"Are you carrier agnostic, can client bring circuits, SDWAN",10,Network,Cloud,DRaaS
"Do you offer Managed Firewall, list platform's",10,Security,Cloud,DRaaS
"Do you offer IDS/IPS, list platform's",10,Security,Cloud,DRaaS
"Do you offer Managed SIEM, list platform's",10,Security,Cloud,DRaaS
"Do you offer WAF, list platform's",10,Security,Cloud,DRaaS
Do you allow for co-management of sercurity infrastructure? If so please list platforms where co-management is supported,10,Security,Cloud,DRaaS
"Do you offer DDoS protection, list platform's",10,Security,Cloud,DRaaS
Do have a SOC,10,Security,Cloud,DRaaS
Do you offer MDR (Managed Detect and Response),10,Security,Cloud,DRaaS
"Do you offer managed backup services, list platform's",10,Data Protection - Backup,Cloud,DRaaS
Do you offer Image based backup supported,10,Data Protection - Backup,Cloud,DRaaS
Do you offer file level backup supported ,10,Data Protection - Backup,Cloud,DRaaS
Do you offer Microsoft VSS application consistency backups supported,10,Data Protection - Backup,Cloud,DRaaS
Local redundant and Geo redundant storage options,10,Data Protection - Backup,Cloud,DRaaS
Do you offer Self service restoration,10,Data Protection - Backup,Cloud,DRaaS
Do you offer Data encryption at rest,10,Data Protection - Backup,Cloud,DRaaS
Do you offer managed DRaaS,10,Data Protection - DR,Cloud,DRaaS
Do you offer customer and/or hybrid managed DRaaS,10,Data Protection - DR,Cloud,DRaaS
What are your supported RPO(s),10,Data Protection - DR,Cloud,DRaaS
How do you charge for DRaaS,10,Data Protection - DR,Cloud,DRaaS
Is a DR runbook created/maintained,10,Data Protection - DR,Cloud,DRaaS
What replication/orchestration technologies do you offer,10,Data Protection - DR,Cloud,DRaaS
How many tests are built into offering ,10,Data Protection - DR,Cloud,DRaaS
Do you support RedHat and Windows server OS's,10,Data Protection - DR,Cloud,DRaaS
"Do you offer managed AWS/Azure/Google, if so are there certain services not supported (PaaS/Microservices/AI/Big Data etc)",10,Data Protection - DR,Cloud,DRaaS
"Do you offer managed VMware on AWS/Azure, describe managed service offerings",10,Data Protection - DR,Cloud,DRaaS
Are your managed AWS/Azure/Google offering supported in house or outsourced to partner,10,AWS/Azure/Google,Cloud,DRaaS
Do you offer cost optimization services,Info,AWS/Azure/Google,Cloud,DRaaS
How many AWS/Azure/Google cerfified engineers  on staff,10,AWS/Azure/Google,Cloud,DRaaS
Do you offer cloud readiness asessments for AWS/Azure/Google if so is this in house or outsourced to partner,10,AWS/Azure/Google,Cloud,DRaaS
"Do you offer cloud transformation (replatform/refactor workloads and applications), if so is this in house or outsourced to partner",10,AWS/Azure/Google,Cloud,DRaaS
Do you offer migration assistance from customer premise (VMware) workloads to AWS/Azure/Google? If so please explain capabilities,Info,AWS/Azure/Google,Cloud,DRaaS
"Do you offer colocation, if so list minimum space/cabinet requirements",10,AWS/Azure/Google,Cloud,DRaaS
Describe power delivery options (dedicated power whip/metered power),10,AWS/Azure/Google,Cloud,DRaaS
Year CCaaS platform introduced,Info,Colocation,Cloud,DRaaS
Current CCaaS endpoints deployed,Info,Colocation,Cloud,DRaaS
Prior names,10,Overview,CCaaS,Contact Center
Uptime SLA,10,Overview,CCaaS,Contact Center
Number of voice gateway datacenters,Info,Overview,CCaaS,Contact Center
Number of call control datacenters,10,Overview,CCaaS,Contact Center
Number of PSTN Carrier Connections,10,Overview,CCaaS,Contact Center
NOC locations,10,Overview,CCaaS,Contact Center
Compliance certifications,10,Overview,CCaaS,Contact Center
PCI,10,Overview,CCaaS,Contact Center
SOC2,10,Overview,CCaaS,Contact Center
Skills based routing,Pass/Fail,Overview,CCaaS,Contact Center
Variable skill levels,Pass/Fail,Overview,CCaaS,Contact Center
Maximum number of skills per agent,Pass/Fail,Functional Requirements,CCaaS,Contact Center
Software compatibility,Pass/Fail,Functional Requirements,CCaaS,Contact Center
Chrome/Chromium/Edge web client,10,Functional Requirements,CCaaS,Contact Center
Fat client for Windows,10,Functional Requirements,CCaaS,Contact Center
Real time reporting,10,Functional Requirements,CCaaS,Contact Center
Historical reporting,10,Functional Requirements,CCaaS,Contact Center
Full call detail records,Pass/Fail,Functional Requirements,CCaaS,Contact Center
Selectable caller ID,Pass/Fail,Functional Requirements,CCaaS,Contact Center
OKTA SSO,10,Functional Requirements,CCaaS,Contact Center
Caller ID,10,Functional Requirements,CCaaS,Contact Center
After call work timer,Pass/Fail,Functional Requirements,CCaaS,Contact Center
Barge/Coach,Pass/Fail,Functional Requirements,CCaaS,Contact Center
Stored/accessible Chat/Email transcripts,Pass/Fail,Functional Requirements,CCaaS,Contact Center
Searchable?,Pass/Fail,Functional Requirements,CCaaS,Contact Center
Ability to manage hold music/hold messages,10,Functional Requirements,CCaaS,Contact Center
Per IVR/Queue RBAC,10,Functional Requirements,CCaaS,Contact Center
Omnichannel,10,Functional Requirements,CCaaS,Contact Center
Voice,10,Functional Requirements,CCaaS,Contact Center
Chat,10,Functional Requirements,CCaaS,Contact Center
Chatbots/Self service chat,Pass/Fail,Functional Requirements,CCaaS,Contact Center
Email,Pass/Fail,Functional Requirements,CCaaS,Contact Center
SMS,10,Functional Requirements,CCaaS,Contact Center
Social,Pass/Fail,Functional Requirements,CCaaS,Contact Center
Co-browsing,Pass/Fail,Functional Requirements,CCaaS,Contact Center
Escalate/transfer between channels,10,Functional Requirements,CCaaS,Contact Center
Admin Self Service,10,Functional Requirements,CCaaS,Contact Center
Visual call flow editor,10,Functional Requirements,CCaaS,Contact Center
Assign/request new TFN,10,Functional Requirements,CCaaS,Contact Center
Supervisor Self Service,10,Functional Requirements,CCaaS,Contact Center
Create/change/disable users,10,Functional Requirements,CCaaS,Contact Center
Set special days (holidays/closures/etc.),10,Functional Requirements,CCaaS,Contact Center
Force agent to not ready/log out,10,Functional Requirements,CCaaS,Contact Center
Set skills on agents,10,Functional Requirements,CCaaS,Contact Center
"Modify Queues, recordings",10,Functional Requirements,CCaaS,Contact Center
Automated Provisioning (Okta),10,Functional Requirements,CCaaS,Contact Center
Agent facing dashboard,10,Functional Requirements,CCaaS,Contact Center
Agent Assist,10,Functional Requirements,CCaaS,Contact Center
Pull from Sharepoint,10,Functional Requirements,CCaaS,Contact Center
Pull from CRM knowledgebase,10,Functional Requirements,CCaaS,Contact Center
Salesforce,10,Functional Requirements,CCaaS,Contact Center
Manual Search,10,Functional Requirements,CCaaS,Contact Center
AI based,10,Functional Requirements,CCaaS,Contact Center
Queued callback,10,Functional Requirements,CCaaS,Contact Center
Position in line/estimated wait time,10,Functional Requirements,CCaaS,Contact Center
Natural language voice IVR,10,Functional Requirements,CCaaS,Contact Center
Bypass IVR based on inbound caller ID and called phone number,10,Functional Requirements,CCaaS,Contact Center
Bypass IVR based on inbound area code and called phone number,10,Functional Requirements,CCaaS,Contact Center
Soft phone support,Pass/Fail,Functional Requirements,CCaaS,Contact Center
Client Authentication/Caller Verify,Pass/Fail,Functional Requirements,CCaaS,Contact Center
Internal Extension Transfers,Pass/Fail,Functional Requirements,CCaaS,Contact Center
Demand Forcasting,10,Functional Requirements,CCaaS,Contact Center
Agent Scheduling,10,Functional Requirements,CCaaS,Contact Center
Mock Schedules,Pass/Fail,Work Force Management,CCaaS,Contact Center
Report on compliance/adherance to schedule,Pass/Fail,Work Force Management,CCaaS,Contact Center
Mobile app for employees to manage their schedule,10,Work Force Management,CCaaS,Contact Center
PTO/Schedule management,Pass/Fail,Work Force Management,CCaaS,Contact Center
Gamification,10,Work Force Management,CCaaS,Contact Center
UKG (formerly Ultipro) HRIS Integration,Pass/Fail,Work Force Management,CCaaS,Contact Center
AI Assisted Scheduling ,10,Work Force Management,CCaaS,Contact Center
Language support - English and Spanish,10,Work Force Management,CCaaS,Contact Center
Quality Management,10,Work Force Management,CCaaS,Contact Center
AI based auto-scoring (100% scoring),10,QM and Post Call Analytics,CCaaS,Contact Center
Sentiment Analysis,10,QM and Post Call Analytics,CCaaS,Contact Center
Ability to handle multiple dialects and ESL,10,QM and Post Call Analytics,CCaaS,Contact Center
Call transcription,10,QM and Post Call Analytics,CCaaS,Contact Center
Support for Spanish,10,QM and Post Call Analytics,CCaaS,Contact Center
Real time sentiment analysis with escalation,10,QM and Post Call Analytics,CCaaS,Contact Center
Screen recording,10,QM and Post Call Analytics,CCaaS,Contact Center
Screen recording tied to the voice recording,10,QM and Post Call Analytics,CCaaS,Contact Center
Ability to train the transcription or AI scoring,Pass/Fail,QM and Post Call Analytics,CCaaS,Contact Center
Custom scorecards,Pass/Fail,QM and Post Call Analytics,CCaaS,Contact Center
Customizable detailed reporting,10,QM and Post Call Analytics,CCaaS,Contact Center
Post Call Analytics,10,QM and Post Call Analytics,CCaaS,Contact Center
Auto disposition calls,10,QM and Post Call Analytics,CCaaS,Contact Center
Surface the reason for calls,10,QM and Post Call Analytics,CCaaS,Contact Center
SQL dips for telephone banking,10,QM and Post Call Analytics,CCaaS,Contact Center
FIS Horizon,10,QM and Post Call Analytics,CCaaS,Contact Center
NCR Voyix - Digital Insight,Pass/Fail,Inegrations,CCaaS,Contact Center
Open APIs,Pass/Fail,Inegrations,CCaaS,Contact Center
Lexis Nexis (Client Authentication),10,Inegrations,CCaaS,Contact Center
ServiceNow,10,Inegrations,CCaaS,Contact Center
Types of Bots/Channels,10,Inegrations,CCaaS,Contact Center
Language support,10,Inegrations,CCaaS,Contact Center
Multi-intent support,10,Inegrations,CCaaS,Contact Center
"Additional internal use cases (HR, Accounting, etc.)",10,Inegrations,CCaaS,Contact Center
"Pricing (Price varies by location/vehicle, etc. Requires about 10 questions to determine)",10,Functional Rqquirements ,CCaaS,IVA
Locations,10,Functional Rqquirements ,CCaaS,IVA
Hours (including any special closures stored in ServiceNow),10,Functional Rqquirements ,CCaaS,IVA
Live transfer to store in specific cases,10,Functional Rqquirements ,CCaaS,IVA
Live transfer to customer care,10,VCC,CCaaS,IVA
Agent-assist tie in to Service Now,10,VCC,CCaaS,IVA
Gathering information for the agent,10,VCC,CCaaS,IVA
Check stock/inventory,10,VCC,CCaaS,IVA
Password resets,10,VCC,CCaaS,IVA
Identify trends/search past cases,10,VCC,CCaaS,IVA
Warranty check,10,VCC,CCaaS,IVA
Equipment ordering/provisioning with validation,10,VCC,CCaaS,IVA
"Identify repeat callers (provide updates, correct routing)",10,VIOC Help Desk use cases:,CCaaS,IVA
Confirm tech dispatch/approved onsite,10,VIOC Help Desk use cases:,CCaaS,IVA
Gather information from the caller/Open ticket,10,VIOC Help Desk use cases:,CCaaS,IVA
Triage - send calls to the correct group (reduce transfers from agents),10,VIOC Help Desk use cases:,CCaaS,IVA
"Tap into AI Ops to get ticket status, send notifications, be proactive",10,VIOC Help Desk use cases:,CCaaS,IVA
Invoice lookup,10,VIOC Help Desk use cases:,CCaaS,IVA
Case lookup and pass to agent,10,VIOC Help Desk use cases:,CCaaS,IVA
Invoice request,10,VIOC Help Desk use cases:,CCaaS,IVA
Check claim status,10,VIOC Help Desk use cases:,CCaaS,IVA
Accept payment,10,Customer Care use cases: ,CCaaS,IVA
Outbound calls or SMS reminders to update tickets/claims,10,Customer Care use cases: ,CCaaS,IVA
Allow managers to include a bot in a claim denial call to record and transcribe,10,Customer Care use cases: ,CCaaS,IVA
"Allow managers to update claim tickets (record, transcribe and update CRM)",10,Customer Care use cases: ,CCaaS,IVA
Accent Neutralization,10,Customer Care use cases: ,CCaaS,IVA
AI Knowledge search,10,Customer Care use cases: ,CCaaS,IVA
Interaction summarization,10,Customer Care use cases: ,CCaaS,IVA
Next best action guidance,10,Customer Care use cases: ,CCaaS,IVA
Real-time agent coaching,10,Additional Capabilities for Agent Interactions,CCaaS,IVA
Noise Cancellation,10,Additional Capabilities for Agent Interactions,CCaaS,IVA
Promise management,10,Additional Capabilities for Agent Interactions,CCaaS,IVA
Real-time language translation,10,Additional Capabilities for Agent Interactions,CCaaS,IVA
AI CSAT,10,Additional Capabilities for Agent Interactions,CCaaS,IVA
Agent and Business Insights,10,Additional Capabilities for Agent Interactions,CCaaS,IVA
AI auto-scoring for QM,10,Additional Capabilities for Agent Interactions,CCaaS,IVA
Pricing model,10,Additional Capabilities for Agent Interactions,CCaaS,IVA
In Contact,10,Additional Capabilities for Agent Interactions,CCaaS,IVA
Pass interaction data into In Contact for live agent (or into Service Now),10,Additional Capabilities for Agent Interactions,CCaaS,IVA
Service Now,10,Additional Capabilities for Agent Interactions,CCaaS,IVA
